{
  "change_id": "CHG-2026-004",
  "schema_version": "1.0.0",
  "change_class": "C4",
  "timestamp": "2026-08-09T13:18:00Z",
  "initiator": "ChatGPT coordinator under explicit user approval for pre-unfreeze hardening",
  "reason": "Require strict fail-closed semantic extraction/enrichment integrity with no silent source-section gaps and require a formal machine-readable handoff from every terminal controlled ChatGPT study session, with explicit predecessor handoff consumption by each successor.",
  "old_version_or_hash": "pre-unfreeze readiness baseline before semantic-integrity and mandatory-handoff controls",
  "new_version_or_hash": "semantic-pipeline-v1-handoff-v1-session-v1.2-chat-v1.1",
  "affected_items": [
    "docs/11-study-session-management.md",
    "docs/12-coordinator-governance.md",
    "docs/16-chat-session-management.md",
    "docs/18-semantic-pipeline-integrity.md",
    "docs/19-session-handoff-continuity.md",
    "schemas/session-v1.schema.json",
    "schemas/chat-session-v1.schema.json",
    "schemas/handoff-v1.schema.json",
    "schemas/semantic-pipeline-v1.schema.json",
    "prompts/qa-v1.md",
    "prompts/enrich-v1.md",
    "prompts/enrich-qa-v1.md",
    "qa/validate_semantic_pipeline.py",
    "qa/semantic_pipeline_regression.py",
    "qa/validate_handoffs.py",
    "qa/handoff_regression.py",
    "qa/control_snapshot.py",
    "qa/validate_control_plane.py",
    "qa/control_regression.py",
    "qa/validate_chat_sessions.py",
    "qa/end_to_end_dry_run.py",
    "qa/readiness_audit.py",
    "qa/pipeline_fingerprint.py",
    ".github/workflows/pipeline-smoke.yml",
    ".github/workflows/control-plane.yml",
    "state/pipeline-health.json",
    "state/project-state.json"
  ],
  "affected_units": [],
  "affected_objectives": [],
  "affected_artifacts": [],
  "affected_sessions": [],
  "required_qa": [
    "Full Fedora pipeline-smoke workflow against current official AWS Markdown",
    "Architecture-significant live-source sentinel preservation",
    "Strict semantic extraction/enrichment schema validation",
    "Semantic negative regressions including missing sections, unreviewed HIGH claims, orphan lineage, weakened fidelity/qualifier scores, unresolved HIGH conflict, and semantic drift",
    "Artifact QA regression and deterministic rendering",
    "Mandatory handoff schema and negative regression validation",
    "Successor handoff-consumption rejection test",
    "Full project/mastery/session/chat/handoff control-plane validation",
    "Synthetic two-session end-to-end semantic + chat + handoff continuity dry run",
    "Final readiness audit with both hardening gates PASS and study-start approval still BLOCKED"
  ],
  "migration_actions": [
    "Advance controlled study-session schema to 1.2.0 and ChatGPT chat schema to 1.1.0.",
    "Require operational pipeline GREEN plus per-packet semantic-integrity PASS for trusted extraction/enrichment use.",
    "Require 100% human review of HIGH provider claims and zero silent selected-section gaps.",
    "Require all terminal controlled sessions to create handoff.json even if next-session selection is pending.",
    "Require successor sessions to record predecessor_session_id and consumed_handoff_id before ACTIVE state.",
    "Re-certify pipeline health under the new fingerprint before restoring technical READY_TO_START.",
    "Keep real SAP-C02 study frozen until separate explicit user study-start approval."
  ],
  "approval_status": "APPROVED",
  "approved_by": "User approval granted in conversation on 2026-08-09",
  "effective_at": "2026-08-09T13:18:00Z"
}
