{
  "change_id": "CHG-2026-003",
  "schema_version": "1.0.0",
  "change_class": "C4",
  "timestamp": "2026-08-09T12:22:00Z",
  "initiator": "ChatGPT coordinator under explicit user approval for the final pre-study readiness audit",
  "reason": "Reconcile stale pre-validation governance language, close remaining pre-study decisions, bind controlled study-session snapshots to current GREEN pipeline health, align ChatGPT chat validation with the approved lifecycle, and add an executable final readiness audit before study-start approval can be considered.",
  "old_version_or_hash": "pre-study control baseline before final readiness remediation",
  "new_version_or_hash": "pre-study-readiness-audit-v1",
  "affected_items": [
    "README.md",
    "docs/00-system-charter.md",
    "docs/01-system-architecture.md",
    "docs/02-chatgpt-operating-spec.md",
    "docs/03-source-policy.md",
    "docs/04-study-sequence-spec.md",
    "docs/10-tooling-evaluation.md",
    "docs/15-study-tool-policy.md",
    "aws/sap-c02/source-inventory.md",
    "schemas/session-v1.schema.json",
    "state/project-state.json",
    "qa/control_snapshot.py",
    "qa/validate_control_plane.py",
    "qa/control_regression.py",
    "qa/validate_chat_sessions.py",
    "qa/end_to_end_dry_run.py",
    "qa/readiness_audit.py",
    ".github/workflows/control-plane.yml"
  ],
  "affected_units": [],
  "affected_objectives": [],
  "affected_artifacts": [],
  "affected_sessions": [],
  "required_qa": [
    "Current GREEN extraction-pipeline fingerprint validation",
    "Full Fedora pipeline-smoke workflow",
    "Artifact QA regression and deterministic render validation",
    "Project/mastery/session schema and cross-file control-plane validation",
    "ChatGPT chat-session lifecycle validation",
    "Negative governance regressions including stale pipeline snapshot rejection",
    "Final pre-study static readiness audit",
    "Synthetic end-to-end session plus ChatGPT chat lifecycle dry run",
    "Final project-state validation with study-start approval still BLOCKED"
  ],
  "migration_actions": [
    "Treat docs/00 and docs/01 as approved current authorities rather than draft planning documents.",
    "Remove obsolete Issue #2/#3/#4 provisional gate language from operational source and sequence policies.",
    "Use controlled study-session schema version 1.1.0 and include pipeline-health state/version/fingerprint in every control snapshot.",
    "Do not create chat.json while a session is PLANNED; bind any opened controlled chat to the session snapshot ID.",
    "Keep personal learner notes local-only by default outside the public repository.",
    "Require qa/readiness_audit.py to pass in control-plane CI before declaring technical study readiness.",
    "Keep real SAP-C02 study frozen until separate explicit user study-start approval."
  ],
  "approval_status": "APPROVED",
  "approved_by": "User approval granted in conversation on 2026-08-09",
  "effective_at": "2026-08-09T12:22:00Z"
}
